{
  "schema_version": "1.0",
  "id": "INC-3001",
  "title": "Order notifications delayed by provider outage",
  "track": "support",
  "type": "incident",
  "phase": "close",
  "status": "completed",
  "risk": "high",
  "owner": "incident-commander",
  "conversation_profile": "support-incident-engineer",
  "last_updated": "2026-08-22",
  "severity": "sev2",
  "implementation_required": false,
  "classification": {
    "complexity": "low",
    "impact": "system",
    "security": "none",
    "confidence": "high",
    "routing": "extended"
  },
  "reclassification": [],
  "phase_history": ["triage", "contain", "observe", "close"],
  "policy_exceptions": []
}
